{
  "id": "XREF-STORY-10275E334CADCA80AC859AE2",
  "domain": "STORY",
  "canonical_ref": "mftl:MYTH-JERUSALEM-TEMPLE-DESTRUCTION-PROPHECY-000001",
  "repository": "bjo163/rocksoul-mftl",
  "canonical_path": "data/records/MYTH-JERUSALEM-TEMPLE-DESTRUCTION-PROPHECY-000001.json",
  "verification": {
    "state": "VERIFIED",
    "commit_sha": "48ca982cbce8e89843b66d564f2fdfeba6b73ace",
    "verified_at": "2026-09-08T00:16:16Z",
    "evidence_path": "data/records/MYTH-JERUSALEM-TEMPLE-DESTRUCTION-PROPHECY-000001.json",
    "match_kind": "CANONICAL_RECORD"
  },
  "ownership": "FOREIGN",
  "snapshot": null
}
